{
  "$schema": "http://json-schema.org/draft-07/schema#",
  "title": "usg-tacacs-server config",
  "type": "object",
  "properties": {
    "listen_tls": {
      "type": "string",
      "pattern": "^.+:\\d+$"
    },
    "listen_legacy": {
      "type": [
        "string",
        "null"
      ],
      "pattern": "^.+:\\d+$"
    },
    "tls_cert": {
      "type": "string"
    },
    "tls_key": {
      "type": "string"
    },
    "client_ca": {
      "type": "string"
    },
    "tls_trust_root": {
      "type": "array",
      "items": {
        "type": "string"
      },
      "default": []
    },
    "secret": {
      "type": [
        "string",
        "null"
      ],
      "minLength": 8
    },
    "legacy_nad_secret": {
      "type": "array",
      "items": {
        "type": "object",
        "properties": {
          "ip": {
            "type": "string",
            "format": "ipv4"
          },
          "secret": {
            "type": "string",
            "minLength": 8
          }
        },
        "required": [
          "ip",
          "secret"
        ],
        "additionalProperties": false
      },
      "default": []
    },
    "forbid_unencrypted": {
      "type": "boolean",
      "default": true
    },
    "tls_psk": {
      "type": [
        "string",
        "null"
      ]
    },
    "user_password": {
      "type": "array",
      "items": {
        "type": "string",
        "pattern": "^.+:.+$"
      },
      "default": []
    },
    "user_password_file": {
      "type": [
        "string",
        "null"
      ]
    },
    "allow_static_credentials": {
      "type": "boolean",
      "default": false
    },
    "ascii_attempt_limit": {
      "type": "integer",
      "minimum": 0,
      "default": 5
    },
    "ascii_user_attempt_limit": {
      "type": "integer",
      "minimum": 0,
      "default": 3
    },
    "ascii_pass_attempt_limit": {
      "type": "integer",
      "minimum": 0,
      "default": 5
    },
    "ascii_backoff_ms": {
      "type": "integer",
      "minimum": 0,
      "default": 0
    },
    "ascii_backoff_max_ms": {
      "type": "integer",
      "minimum": 0,
      "default": 5000
    },
    "ascii_lockout_limit": {
      "type": "integer",
      "minimum": 0,
      "default": 0
    },
    "single_connect_idle_secs": {
      "type": "integer",
      "minimum": 0,
      "default": 300
    },
    "single_connect_keepalive_secs": {
      "type": "integer",
      "minimum": 0,
      "default": 120
    },
    "max_connections_per_ip": {
      "type": "integer",
      "minimum": 0,
      "default": 50
    },
    "max_sessions": {
      "description": "Maximum total sessions across all IPs (0 = unlimited). NIST AC-10 compliance.",
      "type": "integer",
      "minimum": 0,
      "default": 0
    },
    "max_sessions_per_ip": {
      "description": "Maximum sessions per IP address (0 = unlimited). NIST AC-10 compliance.",
      "type": "integer",
      "minimum": 0,
      "default": 0
    },
    "tls_allowed_client_cn": {
      "type": "array",
      "items": {
        "type": "string"
      },
      "default": []
    },
    "tls_allowed_client_san": {
      "type": "array",
      "items": {
        "type": "string"
      },
      "default": []
    },
    "ldaps_url": {
      "type": [
        "string",
        "null"
      ],
      "pattern": "^ldaps://.+"
    },
    "ldap_bind_dn": {
      "type": [
        "string",
        "null"
      ]
    },
    "ldap_bind_password": {
      "type": [
        "string",
        "null"
      ]
    },
    "ldap_search_base": {
      "type": [
        "string",
        "null"
      ]
    },
    "ldap_username_attr": {
      "type": "string",
      "default": "uid"
    },
    "ldap_timeout_ms": {
      "type": "integer",
      "minimum": 0,
      "default": 5000
    },
    "ldap_ca_file": {
      "type": [
        "string",
        "null"
      ]
    },
    "ldap_required_group": {
      "type": "array",
      "items": {
        "type": "string"
      },
      "default": []
    },
    "ldap_group_attr": {
      "type": "string",
      "default": "memberOf"
    },
    "policy": {
      "type": "string"
    },
    "schema": {
      "type": [
        "string",
        "null"
      ]
    },
    "check_policy": {
      "type": [
        "string",
        "null"
      ]
    }
  },
  "required": [
    "listen_tls",
    "tls_cert",
    "tls_key",
    "client_ca",
    "policy"
  ],
  "additionalProperties": false
}