{
  "listen_tls": "0.0.0.0:300",
  "listen_legacy": null,
  "tls_cert": "certs/server.pem",
  "tls_key": "certs/server-key.pem",
  "client_ca": "certs/client-ca.pem",
  "tls_trust_root": [],
  "secret": "CHANGE-ME-GENERATE-WITH-openssl-rand-base64-32",
  "legacy_nad_secret": [
    {
      "ip": "192.0.2.10",
      "secret": "CHANGE-ME-GENERATE-WITH-openssl-rand-base64-32"
    },
    {
      "ip": "192.0.2.11",
      "secret": "CHANGE-ME-GENERATE-WITH-openssl-rand-base64-32"
    }
  ],
  "forbid_unencrypted": true,
  "tls_psk": null,
  "allow_static_credentials": true,
  "user_password": [],
  "user_password_file": "/etc/usg-tacacs/creds.txt",
  "ascii_attempt_limit": 5,
  "ascii_user_attempt_limit": 3,
  "ascii_pass_attempt_limit": 5,
  "ascii_backoff_ms": 1000,
  "ascii_backoff_max_ms": 5000,
  "ascii_lockout_limit": 5,
  "single_connect_idle_secs": 300,
  "single_connect_keepalive_secs": 120,
  "max_connections_per_ip": 50,
  "max_sessions": 0,
  "max_sessions_per_ip": 0,
  "tls_allowed_client_cn": [],
  "tls_allowed_client_san": [],
  "ldaps_url": null,
  "ldap_bind_dn": null,
  "ldap_bind_password": null,
  "ldap_search_base": null,
  "ldap_username_attr": "uid",
  "ldap_timeout_ms": 5000,
  "ldap_ca_file": null,
  "ldap_required_group": [],
  "ldap_group_attr": "memberOf",
  "policy": "policy/policy.example.json",
  "schema": "policy/policy.schema.json",
  "check_policy": null
}